COIG - Comunicação de Ocorrência Grave e Indisponibilidade Prolongada em Empreendimentos de Geração,,,,,,,,,,,,,,,,,,68.492/2021,Emergência,UG 73P2 MW SANTO ANTONIO            40 RO,SAESA,UHE.PH.RO.029707-0.01,01/12/2021 15:43:00,25/01/2022 16:35:00,3,"UG40- Sistema de regulação, verificar e sanar falha no regulador de velocidade.

Após revisão, será necessário realizar testes na unidade geradora: sincronizada com tomada de carga em degraus para verificações; caso necessário, desligar a unidade geradora para inspeções e/ou ajustes. Durante as verificações de comportamento, poderá ser necessária a parada da unidade geradora para eventuais ajustes, e posteriormente sincronizá-la.",,,,,,,,,,7.476/2022,Urgência,UG 93P5 MW NOV.PIRATININGA          31 SP,PETROBRAS,UTE.GN.SP.028191-3.01,12/11/2021 23:32:00,03/03/2022 09:22:00,1,Inspeção nos dutos de barras da UG-31.,,,,,,,,,,10.816/2022,Programado em Regime Normal,UG 93P7 MW NOV.PIRATININGA          42 SP,PETROBRAS,UTE.GN.SP.028191-3.01,09/03/2022 17:05:00,28/05/2022 17:06:00,6,"Inspeção C da turbina a gás, manutenção por horas de operação conforme orientação do fabricante.",,,,,,,,,,20.187/2022,Programado em Regime Normal,UG 9P34 MW U.NV.VENECIA2            10 MA,PARNAÍBA II,UTE.GN.MA.030196-5.01,04/05/2022 06:00:00,16/05/2022 12:08:00,0,"Manutenção preventiva nas partes rotativas da unidade, conforme recomendação do fabricante.",,,,,,,,,,
